GEO00002,Khoa hoc Trai Dat,18CTT2,Nguyen Van A,2,106,MON,S1
CHE00002,Hoa dai cuong 2,18CTT1,Nguyen Thi B,3,70,MON,S2
ENV00001,Moi truong dai cuong,18CTT2,Nguyen Van F,2,175,TUE,S2
CSC00004,Nhap mon Cong nghe Thong tin,18CTT3,Huynh Thuy Bao Tran,4,150,WED,S2
CSC10001,Nhap mon lap trinh,18CTT3,Truong Toan Thinh,4,150,MON,S4
MTH00003,Vi tich phan 1B,18CTT2,Le Van Chanh,3,50,WED,S4
MTH00081,Thuc hanh vi tich phan 1B,18CTT2,Nguyen Cao Dang,1,50,MON,S1
MTH00086,Thuc hanh toan roi rac,18CTT1,Le Van Hop,1,50,MON,S3